comedian,original_text,cleaned_text,tokens,tb_polarity,tb_subjectivity,tb_label
My dad just takes it

and hits it really hard

and it starts working amazingly.

They do the same thing

with their kids.

Like when I was younger,

my mom would run around the house

hit me with anything

that was one arm distance away.

Anything.

Belt, rolling pin.

One day she threw

a potato cutlet at me.

And I was like, wait.

Should I irritate her more so that

she throws chutney and bread also?

But dads don't do that.

Dads don't do that.

Dad will just sit in the chair,

look at you and say...

""Hey, come here.

You come here.

I am not running after you.

I will hit you here.""

My parents were

really supportive.

You know they've

supported everything I do.

Even when I was younger they would

push me to do a lot of things.

Especially fancy dress.

Did people here take part

in fancy dress, make some noise!

It's fucking amazing.

I love fancy dress and my mom

was really serious about fancy dress.

You all have to do fancy dress...

She was like very competitive,

you know.

In our school, we had a rule.

If one place plays a character,

another person can't do that. Right?

So in my first fancy dress competition,

I wanted to dress up as Gandhi.

And then I remembered,

why do they call it fancy dress?

I'm dressed up as Gandhi,

which is the least fancy...

a dress can get.

Right?

But there was another kid.

Even he wanted to be Gandhi.

So we were both fighting.

""I will become Gandhi, I will

become Gandhi. I will become Gandhi.""

Then our mothers were

very competitive, got involved.

""No, my son will become Gandhi.

My son will become Gandhi.

My son will become Gandhi.""

Eventually I got to play the part.

But I was really scared,

I was hoping the other mother doesn't

dress her son up like Nathuram Godse.

""Aunty please don't do that.

It'll be very wrong, very wrong.

Don't do that, please.""

So I got to be Gandhi, right?

And I had my full dress on.

I had the dhoti, I had the glasses,

I had the bald cap.

But as I was going up,

the bald cap slipped.

So all the hair in the

front just stood up like that.

So now I have a spike cut.

And I go up on stage,

so basically I was Gandhi

if he was in Dil Chahta Hai.

The second year my mom said...

""You know what we'll

mix it up a little bit.

This time, I am going to

dress you up as a drug addict.""

Hold on, let me explain.

She was like,

""You know what I am going to do?

I am going to give you a straw.

The straw will have powder in it,

you go up on stage

you blow the powder out,

powder goes up.

You cough *coughs*!

Drugs are bad, don't do drugs.""

I'm like sure.

I am 9 years old, I don't give a shit.

So the day happens and

I am waiting in the aisle,

about to go up,

the teacher's on stage

announcing the other guy out

she's like,

""Rohan, that was a very good peacock.

Up next, we have Varun and he is a...

Good peacock, no?

Up next is Varun and he is a...

drug addict.""

And I just walked in

on stage sauntering like that

because that's how

I think drug addicts are.

I've gone in and I've

just blown up! *coughs*

Drugs are bad, don't do drugs.

I came first.

You know, now I realise my mom

made Udta Punjab 20 years ago.

And in the final year of fancy dress,

my mom said...

""You know what? This year you're going

to be something out of this world.""

I'm like, ""Really? What?""

She's like,

""You're going to be Miss World.""

I'm like, ""Sure.

I am 10. I don't give a shit.""

And so I was wearing my cousin

sister's halter dress, off shoulder?

Whatever the fuck that is called.

You know the gloves in my

hand and the tiara and the sash.

And here's how middle

class my parents are.

Even in a hypothetical competition

where they could

dress me up as anything.

They dressed me up as Miss World.

Not Miss Universe.

So I asked my mom.

""Mom! Why can't I be Miss Universe?""

She looked and me and she was like...

""Son, have you seen your face!""

You guys agree that we have

the worst ads on Indian TV, yes?

Make some noise if you

think they are the worst ads.

I think they are getting

worse by the day, right?

The other day was watching

TV and I saw an ad for bottled water.

Manikchand Oxyrich.

Because when I think of clean, pure

drinking water, I think of Manikchand.

It's called Manikchand Oxyrich.

And the tagline is,

""Now with more oxygen.""

Here is a scientific

joke for you, guys.

Chemical composition of water is H2O.

Two atoms of hydrogen,

one atom of oxygen.

More oxygen makes it H2O2.

Which is hydrogen peroxide

which will kill you.

But it's Manikchand.

So it probably is hydrogen peroxide.

Then there was an ad

for a phone company, okay?

I forget which one it is.

And the USP of that phone

is that it's two-way answer phone.

Because you know sometimes

when you answer the phone

you answer it the other way round.

But now don't worry, because

Samsung has a new phone for you guys.

Seriously.

How lazy are these fuckers?

That you had to dedicate an entire

Research & Development

team on doing this.

See, who are these people?

You call them and they'll be like...

""Hello!""

""Yeah, say!""

""Bro, I can't hear you.""

""Because I am holding

the phone the other way round.""

I'm like, ""So hold it properly.""

""No, it's too much work.

I think I need a new phone.""

Every ad on TV is technology, right?

No matter what the product is.

""This has technology.""

Like two letters and

technology after that.

""This has technology.

Wow, we will have to buy it.""

And I was in Pune and I

heard this ad on radio, right?

The ad was...

""A-1 mosquito repellent,

now with Mosquito-Go-Away technology.""

Guys, they've stopped giving a fuck.

They're like, ""Write anything. Write

technology, these morons will buy it.""

Mosquito-Go-Away technology?

Could lesser fucks be

given in naming technology?

It's like he made this technology

and then went to his two year old niece...

""Sweetie, what should I name this?""

""Uncle, what happens with this?""

""Mosquitoes go away.""

""Mosquito-Go-Away technology.""

Then you have ads for face wash.

Like a face wash is

not a face wash anymore.

Face wash is anti-darkening,

anti-pimple,

anti-wrinkle,

anti-twinkle, anti-this, anti-sweat.

A new Garnier face

wash is anti-pollution.

I was like, what?

We are killing it in

science and technology.

We are removing pollution

with our face wash.

I'm like why are poor people in

Delhi following the Odd and Even rule.

They should just be putting

face wash in their exhaust pipe.

Even ads for creams.

When you watch any ad for creams,

what does it say?

""This contains vitamin A,

B, C, D, E, F, G, H, I, J...""

There's more vitamins

in my cream than my breakfast.

And that ad would always end with...

""Vitamin blah blah.

And essential minerals.""

I'm like if the minerals are

so essential, tell me what they are.

Why are you hiding it?

Did you watch any ad for deodorants?

What does it say?

Spray this deodorant,

chicks will have sex with you.

But there is this new deodorant.

New Fogg deodorant.

They changed their USP.

They're like,

""Now, with guaranteed 800 sprays.""

All the Gujjus are like, ""Wow!

What a deal!

800 sprays in 80 rupees?

Amazing!""

No seriously.

Now with guaranteed 800 sprays?

So every time I spray a deodorant, I

have to maintain a fucking excel sheet.

""Kshh kssh! Monday, 2 sprays.""

""Kshh kssh! Wednesday 5 sprays.""

""Kssh! Saturday I'm meeting

a girl so I'll use the whole bottle.""

But there was an ad

a couple of years back.

I don't know how many of you

guys saw. There was an ad--

(distinct laughter)

Wow! Someone's getting the joke now.

There was an ad, there was an ad

a couple of years ago for rat poison.

I don't know if you guys saw that.

And the tagline for that was...

""Rats will eat this inside your

house, then die outside.""

You guys remember that, right?

Tell me one thing.

Are rats that obedient?

And this one rat comes home,

he's eating it.

Suddenly he starts gagging.

Another rat is like, ""Hey Prakash!

What are you doing?

Go outside and die.

Haven't you seen the ad?

Get out.

Get out.

Get out.""

But these are ads on TV.

I'll tell you the worst kind of ads.

Please tell me you

guys watch Teleshopping.

(audience cheers)

It's my midnight entertainment.

Just watch Teleshopping.

The minute you are sad,

tired, depressed in life,

just watch that.

And bless yourself that

you don't have to do that.

Because I have been called

to audition for Telebrands.

I am not even kidding you.

I've been called to

audition for Telebrands.

I was watching it the other day,

I was watching Telebrands.

Any ad for Telebrands

begins like this.

You have a white dude

that just says one thing,

""I used to be very fat.""

It makes no difference

what the product is.

This is a roti maker.

""I used to be very fat.""

""I used to be very fat.""

So the ad that I was

watching the other day,

they were selling

low calorie toothpaste.

Who the fuck is eating toothpaste?

And why?

Can you imagine the ad for that?

""I used to be very fat.

I used to eat all my toothpaste.

While brushing in the morning,

I'd have lunch, breakfast,

dinner all at once.

I used to be an idiot.

But now I use this toothpaste

from Telebrands

and I'm an even bigger idiot now.""

(distinct laughter)

Wow!

We have a hyena in the crowd.

So that's one kind

of Teleshopping ads.

But there is another kind.

It's called Gold Safe.

Has anyone here watched Gold Safe?

I'll tell you for those of you

who don't know Gold Safe is this show

where they show you pictures

of two celebrities put together.

I was 100 percent sure.

50 percent of you

guys have called it also.

Fuck you guys.

I'm sure.

So the Gold Safe is a show

where a picture of

two celebrities are put together.

You know using state-of-the-art

technology like...

Microsoft Paint.

I was watching it the other night,

they had a picture of Sachin Tendulkar

and Kareena Kapoor put together.

Sachin's face is round.

Kareena's face is long.

Their resultant picture

looked like an ice-cream cone.

Because they don't give a fuck.

They're like, ""Add anything.

Nobody will know.""

And then you have this amazing

host who comes up and she says...

""Hello!

You are watching Gold Safe.

If you call now and

guess who are these celebs,

you will get a chance

to win 50 thousand rupees.

Just imagine, what all can

you buy with 50 thousand rupees.

You can buy a car, an AC,

TV, fridge, you can go out

for dinners, you can party too.

In 50 thousand rupees. Come on!

Call now and guess

who are these celebs.""

Compared to her,

Shankar Mahadevan's Breathless

sounds like a fucking lullaby.

I don't know who this chick's cocaine

dealer is but I want her number.

And she is really bad.

She's really bad.

Her entire career

is a bad audition tape.

""Come on, call now and

guess who are these people.""

Then the best thing happens.

Because all the callers call in.

Right?

And these fuckers never get it right.

Okay, so one caller comes in...

""Our first caller.

Come on guess. Who are they?""

""Madam, Sunny Deol and Lara Dutta.""

I'm like a blind goat

can get that answer right.

Then other guy calls up...

""Our second caller.

Guess who these celebs are?""

""Madam, Arjun Rampal

and Kangana Ranaut.""

I'm like you called Sachin Tendulkar,

Arjun Rampal?

Sachin's great with a piece of willow.

Arjun Rampal is the piece of willow.

So maybe.

But still.

And then she realises

no one is getting it right.

Because like 80 people

called and nobody gets it right.

So then she's like...

I can see what you're doing.""

And suddenly you're like, ""Oh shit!""

She's like,

""I can see what you're doing.

I am here just for you. Just for you.

I am here so that you

can win 50 thousand rupees.

50 thousand.

I'll give you hints

if you want to win. Hints.

Check this guy out.

Anjali Tendulkar.""

I'm like really?

That's your hint for Sachin Tendulkar?

Anjali Tendulkar?

And then she's like,

""Check this girl out.

She is not a Ash.

She is not a Sonam.

She is not a Bipasha.

She is not a Katrina.

Her name starts with

K- and ends with -areena Kapoor.

Guess who is she.""

Even then some dickhead

calls up and he's like...

""Oh madam, Sanjay Kapoor!""

Then nowadays they've

started selling viagra...

on Teleshopping.

Have you guys seen that?

Power Prash!

Power Prash!

And they make it seem so legitimate.

You know they have one dude

who is wearing a dhoti and a kurta.

He signifies the

Ayurvedic side of things.

Then next to him is a guy in a suit

who signifies the scientific

side of things.

And then you have Kashmira Shah,

who signifies tits.

And she looks to the

camera and she's like...

""Nowadays a lot of couples

go through a lot of physical problems.

And now let's hear

Manoj and Payal's story

who are facing the

same physical problem.""

And then you cut to a recreation

of Manoj and Payal's life.

Where Manoj is just standing

like that and Payal is just...

And Manoj is like...

""Payal, what happens

to you every morning?""

And Payal looks at him and goes...

""Me? What happens to you every night?""

Ohh!

That's cold.

And Manoj has no comeback right there.

He's like...

And then Payal just goes on and on.

She's like, after marriage have you

even pleasured me?

Those beautiful memories,

those colourful nights.

Those sweet talks.

Those wet dreams.""

Here's the thing.

In this entire ad, for viagra they

don't mention the word sex even once.

They only speak in

these weird euphemisms.

And he's like...

""Payal, but I am trying!""

""Trying? You just keep trying then.

Here are the divorce papers.""

I was like one second.

Why are you roaming

around with divorce papers?

Even divorce lawyers

don't have it handy.

How the fuck do you have it handy?

And she pulled it

out of her Salwar Kameez.

I'm like how the fuck does

the Salwar Kameez have a back pocket?

It's baffling.

And she get's pissed

and she throws and runs away.

And walks out.

And Manoj is like, ""Payal!""

You know because this signifies loss.

And he turns around.

As he turns around, his friend

is behind him.

Who is in a full suit and a tie,

ready to go to work.

And he turns around and he's like...

""Hey! Ravi!""

And Ravi is standing there, okay?

Two things wrong with that.

First thing...

for Ravi to be behind him, he'll

have to have been inside the house.

And he's like, ""What happened Manoj?""

Manoj says,

""I don't know what to say, Ravi.""

""If you won't tell me, then

who else will you tell this to?""

He's like, ""Forget it.""

And walks away.

Walks away, goes to a window.

And just stands in the window.

Because this signifies sadness.

And then Ravi comes from behind.

And as the reassuring hand

of the friend on the shoulder.

You know like...

Like that.

He's like, ""Hey Manoj.

I am your friend.

Tell me what happened.""

And he turns around and again now,

he doesn't say the word sex.

He just says,

""I don't know how to say this, man.

After marriage I haven't been

able to pleasure Payal.

Those colourful memories,

those sweet talks,

Those colourful memories.""

And this is Ravi's response.

""That's it? Such a small problem!""

Here's the thing, Ravi.

If your friend has

an erectile dysfunction,

saying such a small problem...

is not the right thing to say.

And Manoj is like,

""That's not a small problem!""

He's like, ""This is nothing.

Here, use Power Prash.""

Why the fuck is this

guy ready to go to work

with a packet of Power Prash in his...

It's like this dude wakes up

every morning, he's like,

""Lot of my friends can't get it up.""

So I should be a good guy.

And just drop off a pill

At everyone with erectile dysfunction.

Seriously.

This entire ad, is about two people who

have something in their back pocket.

And one person who has

nothing in his front pocket.

But I didn't always

wanted to be a comedian.

I actually wanted to

study filmmaking, you know.

I went abroad to study filmmaking.

I was in London for a year.

Where I spent the first six months trying

to get them to pronounce my name right.

Because they are like, ""Vroon!

Vroon!""

I'm like dude,

just call me Tom, it's okay.

And I spent the next six months

trying to explain to them

what are plastic cups doing in my toilet.

That's always an awkward

conversation right?

All my white friends

would come home and say...

""Vroon! Why is there a

plastic cup in your bathroom?""

""The thing is when I pee,

I get really thirsty so

I'd like to have a glass handy.""

Do you guys like the British accent?

You guys like the British accent?

Sounds very sexy, sounds very cool.

My first proper exposure to

British accent, I walk into school

and this guy is looking at me.

He looks at me...

""Mate can you pass me

the bo-uhl of wa-uh.""

He's like,

""Can you pass me the bo-uhl of wa-uh.?""

I'm like, *gibberish*

One word, English.

Sounds like?

And this guy is pissed off.

This guy is pissed off.

He's like,

""Can you pass me the bo-uhl of wa-uh?""

I'm like bottle of water?

I don't get it.

The British people made the language.

Use all the words.

""No, no. We've invented the language.

We'll omit a few words.

Go fuck yourself!

Now interpret it yourself.

We're not going to spane food.

Spane food?

Spoon feed.

Fuck.

You know the student

hostel I stayed at right?

We decided to have a potluck

and get to know each other.

Now we were all supposed

to cook food from our own country.

I was a really poor student.

I only had a packet of

Poha with me.

Do you all know what Poha is, yes?

So I made Poha and took it for dinner.

I'm like what the fuck

will these caucasians know.

I don't know what the Chinese guy made

but I am pretty sure it wasn't dead.

Because I took a serving

and it started running away from me.

I'm like, ""Hey! Shut the gate.

My dinner is trying to escape.""

The French girl made the *gibberish*

Because that's what

the French people do, right?

Make you eat shit you can't pronounce.

*gibberish*

I'm like, ""Hey! Same to you.""

The Afghan kid kept looking up hoping

for a NATO helicopter to drop something.

He's like, ""Hey! Food please! Food.""

But I wasn't any better.

I only had a plate of Poha with me.

And this white girl walks up to me.

She's like, ""Vroon!

What have you made?""

""These are flattened rice flakes with

robust Indian spices with assorted onion

and dash of lime and sprinkle

of coriander and basil leaves.""

Fuck yeah!

I went Master Chef Andheri on it.

I'm like, ""Here, have some Poha.""

But saying that stuff helps right?

A dash of lime.

Sprinkle of coriander.

Basil leaves.

Basil leaves are like

the push up bras for food.

They don't do shit but

they make your food look great.

So you know when I was in the UK,

they launched the Bandra-Worli

Sea-link so I was fucking excited.

I went to all my friends, I'm like...

""Guys, check out.

There's a sea-link in my city.

There's a sea-link in my city.""

But no one's excited.

Because my flatmates were German,

American and Chinese.

""Hey fuck off. Get lost!""

""We have 30 thousand fuck off.""

I was excited and I had

to share it with someone.

So I was like, ""Hey Bangladeshi.

No, no! I won't hit you.

You come here.

Come here!

Slippers,

leave your slippers outside.""

The Pakistani guy got really excited.

He's like, ""Hey! Sea-link?

Very good, man!

How many entry points does it have?

5? Okay, okay!

We can go there by boat?

By boat?

Okay! Okay!

Do they have police protection?

Okay...okay!""

But that's the thing

with Pakistanis right?

Half the time they

just pretend to be Indians

and the rest of the

time they'll be like...

""Pakistan...Pakistan!""

Especially during sports.

""Pakistan will win today.

Pakistan will win.""

And I'm like dude, relax.

I know you know the

results of all the games.

But chill.

But he's like,

""Today Pakistan will win.

Today Pakistan will definitely win.""

I'm like, ""How?

England is playing Australia.

How will Pakistan win?""

The first time I

went to London, right?

I was in the cab,

I was waiting at a signal

and I see this old Englishman walk.

And he is wearing a jeans,

T-shirt, keds.

Suddenly he walks to my car,

knocks on the window and starts begging.

I'm like,

""There's beggars in London as well?""

""Can you put some change?""

I'm like, ""Hey, buddy listen.

I come from India.

Okay?

I'm so desensitised to beggars,

you have no idea.

The last guy who begged

from me didn't have an arm.

You have to up your game.

Seriously.

You are dressed better than I am.

You speak better English.

Do something at least.

Tear your clothes.

Sing a little.

Something?""

""Hey give me some change.""

""Hey give me some change.""

You know white people

get really excited

when they find out

that you're from India.

""Oh my God!

You're from India?

I love India.

I really want to go to India.""

I'm like, ""Why?""

And they'll all say this one thing.

""To find myself.

I want to find myself.

Yoga and...

...ashram""

I'm like, ""You go to Marol.

You'll never find yourself.""

And it was this girl's

birthday, right?

It was this girl's birthday.

She's Greek, she called us all over.

She was like,

""Guys, you know what would be awesome?

Is if you all sang Happy Birthday

to me in your own language.""

Great, because the

American guy is like...

""Happy Birthday to you.""

And the Chinese guy is like...

""Fu fu!""

Whatever.

I'm not being racist.

Every country has the

same tune for happy birthday.

Now they're all looking at me.

And I'm just standing there

like a constipated Udit Narayan going...

""May this day come again and again.

My heart sings again and again.

May you live a thousand years,

I pray.

Happy Birthday to you.""

Why couldn't we have the

same tune for Happy Birthday?

Where is Pritam when you need him?

Alright guys, that's been my time.

You've been absolutely fantastic.

Thank you so much.

Welcome on the stage,

struggling actor...

Vicky Malhotra!

Yes hi friends Vicky this side.

And yosulf?

Very very fantastic.

Good to be here.

Hi baby! Is that your brother?

Bro, don't leave her alone like this.

Yes hi guys.

I know most of you all know mahsulf.

But if you all don't then

probably you are living under a rock

or Koparkhairne or whatever.

Because both places

don't have Snapchat.

But for all you loserz

who don't know mahsulf.

I have to tell you stuff about me.

If there are any

directors in the crowd

or whatever or they want to make

a biopic on me or whatever.

So you'll know everything.

Okay!

So here's the thing about me.

I'm a guy.

And mah profiles are...

Thank you.

My chest is 38 inches,

biceps 22 inches,

penis 11 inches.

And when I am not horny it's 10 inches.

Mah hobbies are living,

chilling, killing, raging,

dancing, internet and pilates.

Mah best friend is Sunny.

He's an actor.

Tommy, he's an actor.

Juggy, he's an actor.

Lovey, he's an actor.

Monty, he's an actor.

And Sanket...

he's a physicist.

But we don't talk to him much

because he's a very pretty lame guy.

Since school he's been

so lame like he likes reading.

Who the fuck likes reading?

Who the fuck likes reading?

And that idiot would

sit and learn trigonometry.

I'm like bro, you're never going to

use trigonometry in real life.

Never.

Like where will you go?

You go to buy vegetables.

""Sir, give me some tomatoes.

What is the tan theta for this?

Tan theta?""

You don't do that.

You don't do that.

But I am also a reader.

I am also a reader.

There is this amazing

book that I read you know.

It helps me calm, chillax, relax.

It's for good for me time.

You must've heard of it.

It's called Playboy.

Once I pick the book up,

I just can't keep it down.

Get it?

Bro, you know what the joke is right?

Because I have an erection,

I can't keep it down.

That's the joke.

Mah favourite sun sign is Scorpion.

And...

(audience cheers)

And I am an Aries.

Mah favourite song is Summer of '639.

It's fucking amazing.

Like Summer of '639.

I don't know what 639 is.

I think it's a band name,

school roll number whatever.

But it's fantastic.

I love it.

I love it.

Very pretty fantastic that is.

Mah favourite non-veg

food is butter chicken.

And mah favourite veg

food is also butter chicken.

Because veg food sucks.

And I think vegans should

just stab themselves with a carrot.

Like seriously.

What the fuck are these vegans?

They're so annoying.

Like I'll tell you

why I get irritated okay.

Like the other day, I went

on a date with this slutty chick.

And...

We went for the date

and so I called for mah food.

You know I called for butter chicken,

chicken tikka masala,

butter naan, chicken naan, garlic naan

and edamame sushi.

And I told her, ""Yosulf

can call for whatever you want.""

And she's like, ""Vicky!

I'm very pretty sorry.

But I'm a vegan.""

I'm like, ""Oh my God.

Oh my God.

Yosulf is a vegan?

What are you going to tell me next?

You have herpes?""

But anyway she had

nice tits so I stayed.

And then she called for her food.

She called for organic,

non gluten, non dairy,

non tasty, legume only salad.

Basically she called

for air in a bowl.

Then we called for the bill and

mah bill was 600 and her bill is 1200.

1200?

I'm like how does your food have half

the ingredients and is twice the price?

But she has nice tits, so I paid.

No, but I told the slutty vegan chick,

I told her, ""Listen.

Your dinner might be vegan

but your dessert is at my house

and it's non-vegan.""

Yea, I've never spoken

to her after that but fuck it.

You know but like see,

I'm a sexist guy.

I'm a sexist guy.

I am telling you straight up,

I'm a sexist guy.

Alright?

My friends are like...

